{
  "id": "PL7030_M",
  "nombre": "Toldo de palilleria simple PL7030 autoportante 4 patas",
  "tipo": "palilleria",
  "version": "2025.09",
  "fuente": {
    "abd": "PL7030_M.abd"
  },
  "dimensiones": {
    "linea": {
      "min": 0,
      "max": 0,
      "valores": []
    },
    "salida": {
      "min": 0,
      "max": 0,
      "valores": []
    }
  },
  "tarifa": {
    "matriz": {}
  },
  "motores": [],
  "reglas": []
}