{
  "id": "PL7010_M_31_05_2023",
  "nombre": "Toldo de palilleria simple PL7010 con porteria sin refuerzos",
  "tipo": "palilleria",
  "version": "2025.09",
  "fuente": {
    "abd": "PL7010_M 31-05-2023.abd"
  },
  "dimensiones": {
    "linea": {
      "min": 0,
      "max": 0,
      "valores": []
    },
    "salida": {
      "min": 0,
      "max": 0,
      "valores": []
    }
  },
  "tarifa": {
    "matriz": {}
  },
  "motores": [],
  "reglas": []
}