{
  "id": "PL7020_M",
  "nombre": "Toldo de palilleria simple PL7020 con porteria con refuerzos",
  "tipo": "palilleria",
  "version": "2025.09",
  "fuente": {
    "abd": "PL7020_M.abd"
  },
  "dimensiones": {
    "linea": {
      "min": 0,
      "max": 0,
      "valores": []
    },
    "salida": {
      "min": 0,
      "max": 0,
      "valores": []
    }
  },
  "tarifa": {
    "matriz": {}
  },
  "motores": [],
  "reglas": []
}